{
  "schema_version": "1.0",
  "event_id": "example-telemetry.normalized-001",
  "event_type": "telemetry.normalized",
  "tenant_id": "tenant-01",
  "mission_id": "mission-001",
  "session_id": "session-001",
  "analysis_run_id": "live-run-001",
  "region_epoch": 1,
  "owner_epoch": 1,
  "occurred_at": "2026-09-26T12:00:00.000Z",
  "received_at": "2026-09-26T12:00:00.100Z",
  "produced_at": "2026-09-26T12:00:00.200Z",
  "source_sequence": 1842,
  "trace_id": "example-trace-001",
  "causation_id": null,
  "payload": {
    "sensor_id": "wind-estimator-01",
    "measurement_kind": "wind",
    "measurement_basis": "estimated",
    "coordinate_frame": "NED",
    "source_clock": {
      "domain": "device_boot",
      "raw_ticks": 123000000,
      "ticks_per_second": 1000000,
      "mapping_id": "clock-map-01",
      "uncertainty_ms": 10
    },
    "value": [
      3.2,
      1.1,
      null
    ],
    "unit": "m/s",
    "quality": "valid",
    "location_ref": "pose-1842",
    "height_reference": "MSL"
  }
}
